{
  "approval_id": "approval_037cbe4de4a16e456998acd6",
  "approver_id": "human_reviewer",
  "candidate_hash": "sha256:556083dd71ed01078f5bd1a6164abd88660824ed2170030d0bfa13f0cdd00b6d",
  "candidate_id": "candidate_fb4a3fd06ced1113d27bacd8",
  "decided_at": "2026-01-01T00:00:00Z",
  "decision": "approved",
  "rationale": "Verified candidate approved for the requested exact use.",
  "record_hash": "sha256:17be991976ac2f2e07fc295ef29249926c6313b5054a8bc4b48bc86fb731b3af",
  "verification_result_hash": "sha256:310b1bbad7a629b9f792615d4d3b6ad2b2abe9e7dd6da3a76ab06eaf5095722f"
}
